[
  {
    "date": "2025-10-06",
    "title": "Static caches require ConcurrentDictionary wrappers",
    "category": "process",
    "scope": "project",
    "evidence": "osafw-app/App_Code/fw/DB.cs uses static schema caches shared across requests",
    "recommendation": "Ensure all shared caches use thread-safe collections and document the requirement.",
    "source_paths": [
      "osafw-app/App_Code/fw/DB.cs",
      "osafw-app/App_Code/fw/ParsePage.cs"
    ]
  }
]
